{
  "schema_version": "coh.pysigma-provenance/v1",
  "contract_version": "1.0.0",
  "request_digest": "sha256:90c7530b5c8518e13396433dffff4dbb73afbe76c729693970caae11d406f25a",
  "response_digest": "sha256:be17e6a4a8cd457ddfa48b3137c5bb399910b81894eb743db5a53fd31e4ae7cf",
  "sigma_digest": "sha256:053b45f48c696d561e5f9d4c9ada82869b4e06e14792f0031bd8fbfa08adea64",
  "mapping_digest": "sha256:cc791f2da3d3f476797218efe7954a0bfbaf28239ba9ba1c3f4205838206fb39",
  "target_schema_digest": "sha256:2222222222222222222222222222222222222222222222222222222222222222",
  "native_query_digest": "sha256:8db03a1f1be294276bf23f65c702ee98dfcf7040e7bde5c43036d233e121b008",
  "helper_attestation_digest": "sha256:9999999999999999999999999999999999999999999999999999999999999999",
  "capability_digest": "sha256:3333333333333333333333333333333333333333333333333333333333333333",
  "qualification_digest": "sha256:4444444444444444444444444444444444444444444444444444444444444444",
  "policy_digest": "sha256:4aa39e05e360811d945a573a648c931d0a698453b80a9911cc9ca903b6930e4e",
  "audit_reservation_digest": "sha256:ffffffffffffffffffffffffffffffffffffffffffffffffffffffffffffffff",
  "state": "compiled_untrusted",
  "digest": "sha256:9b764e7c2e0c58bd3cd4c06ee627f5a12faf0bb932a709b4dabf4d471784b095"
}
